"zpid","price","address","bedrooms","bathrooms","sqft","price_per_sqft","property_type","status","latitude","longitude","state","region","hoa","mls_number","parking_garage","description","days_on_market","year_built","acreage","front_photo","image_path","link","scraped_at"
"20577727","$1,700,000","3804 Duray Pl, Los Angeles, CA 90008","3","3","2,738",620.89,"Single Family","For Sale",34.009315,-118.36508,"CA","Los Angeles",NA,"25592287","Carport","REMODELED BALDWIN VISTA COURTYARD HOME - Experience the essence of luxurious indoor-outdoor living in this re imagined home, where soaring floor-to-ceiling glass walls open to serene courtyards, filling every room with fresh air and natural light. Discover how a courtyard floor plan can add richness to your life, and increase the efficiency and comfort of your new home. Rich hardwood floors flow seamlessly throughout, accentuating the home's open and spacious design. This home boasts two excepti",NA,"1967",NA,"","property_images/20577727_img1.jpg","https://www.zillow.com/homedetails/3804-Duray-Pl-Los-Angeles-CA-90008/20577727_zpid/",2025-11-21 09:47:38.324484
"19971597","$895,000","14937 Friar St, Van Nuys, CA 91411","5","3","1,971",454.08,"Single Family","For Sale",34.185898,-118.45874,"CA","Van Nuys",NA,"SR25249310","Carport","Listing Provided by: Karina Villagomez DRE #01924652 805-791-5256,Luxury Collective Step inside this beautifully remodeled home that perfectly blends modern style with timeless comfort. Featuring 5 spacious bedrooms and 3 updated bathrooms, this home offers approximately 1,900 sqft of bright and inviting living space. Enjoy the convenience of a private driveway, detached garage, and a large 6,400 sq ft lot, ideal for entertaining, gardening, or even future expansion. The freshly updated interior",NA,"1946",NA,"","property_images/19971597_img1.jpg","https://www.zillow.com/homedetails/14937-Friar-St-Van-Nuys-CA-91411/19971597_zpid/",2025-11-21 09:47:38.324484
"20765189","$999,000","4707 Toland Way, Los Angeles, CA 90042","3","2","954",1047.17,"Single Family","For Sale",34.120304,-118.21387,"CA","Los Angeles",NA,"25614569","Carport","Located just moments from York Boulevard's shops and restaurants, this Highland Park home captures the charm and energy of Eastside living. Thoughtfully updated with modern, tasteful finishes, it offers comfortable interiors and a private wrap-around yard designed for effortless indoor-outdoor living. As you step inside, the living room opens up with large windows and a natural flow that connects the home's main spaces. The remodeled kitchen (2021) is both stylish and functional, featuring Bosch",NA,"1946",NA,"","property_images/20765189_img1.jpg","https://www.zillow.com/homedetails/4707-Toland-Way-Los-Angeles-CA-90042/20765189_zpid/",2025-11-21 09:47:38.324484
"20578005","$3,500,000","5255 Veronica St, Los Angeles, CA 90008","3","3","2,166",1615.88,"Single Family","For Sale",34.013542,-118.36108,"CA","Los Angeles",NA,"25597285","Carport","Mid-Century Architectural Masterpiece | Alloi \"Syntax House\" | Baldwin Vista -- Perched high in the Baldwin Vista hills, this completely re-imagined 1952 Mid-Century residencerebuilt from the ground up by Alloi Architecture + Construction, an award-winning architect-led design-build studiodelivers one of the most breathtaking panoramas in Los Angeles. Enjoy unobstructed views of Downtown LA from the front terrace and sweeping vistas of Century City and the Hollywood Hills from the backyard. Ever",NA,"1952","19520.36","","property_images/20578005_img1.jpg","https://www.zillow.com/homedetails/5255-Veronica-St-Los-Angeles-CA-90008/20578005_zpid/",2025-11-21 09:50:26.029478
"20524379","$59,900,000","133 S Mapleton Dr, Los Angeles, CA 90024","9","14","26,522",2258.5,"Single Family","For Sale",34.08171,-118.43328,"CA","Los Angeles",NA,"24-463937","Carport","When an estate surpasses architecture and design, it becomes a work of art. Inspired by the iconic Reina Sofia museum in Madrid & built by a world class art collector on the finest street in Holmby Hills, a spectacular backdrop was created for a personal collection of antiquities & contemporary art. After a decade, the result is rarefied 26,522 Sq feet of museum-quality rooms w/soaring ceilings, carefully curated materials & a flow that makes this landmark home feel both expansive and intimate a",NA,NA,"1.1","","property_images/20524379_img1.jpg","https://www.zillow.com/homedetails/133-S-Mapleton-Dr-Los-Angeles-CA-90024/20524379_zpid/",2025-11-21 09:50:26.029478
"19955216","$699,900","8133 Brimfield Ave, Panorama City, CA 91402","3","2","1,184",591.13,"Single Family","For Sale",34.218884,-118.45873,"CA","Panorama City",NA,"PW25262506","Carport","Listing Provided by: Noelle Longmeyer DRE #01313351 nlongmeyer@gmail.com,Y Realty,Listing Team: Nest Socal Group Welcome to an incredible opportunity to reimagine a classic home with solid bones and exceptional potential. This 3-bedroom, 1.5-bath single-family residence offers 1,184 square feet of living space and sits on two parcels totaling an expansive 7,193 square-foot lot, providing ample room for future improvements, expansion, or outdoor living enhancements. In mostly original condition, ",NA,"1953",NA,"","property_images/19955216_img1.jpg","https://www.zillow.com/homedetails/8133-Brimfield-Ave-Panorama-City-CA-91402/19955216_zpid/",2025-11-21 09:50:26.029478
"20797285","$1,999,999","1417 Queens Rd, Los Angeles, CA 90069","3","2","1,779",1124.23,"Single Family","For Sale",34.095375,-118.37515,"CA","Los Angeles",NA,"25596997","Carport","In a colorful garden setting just a few doors above Sunset, this vintage 2-story Spanish Revival home is ideally located in the heart of the Strip, close to many great dining establishments, upscale hotels, the Sunset Plaza shopping district, and West Hollywood's most happening nightlife. As you approach the gated home, you'll be charmed by the lush, vibrant landscaping. Enter through the original paneled front door and be welcomed by the arched walls, warm oak floors, and coved plaster ceilings",NA,"1936",NA,"","property_images/20797285_img1.jpg","https://www.zillow.com/homedetails/1417-Queens-Rd-Los-Angeles-CA-90069/20797285_zpid/",2025-11-21 09:50:26.029478
"72506359","$3,395,000","709 Vernon Ave, Venice, CA 90291","4","5","2,470",1374.49,"Single Family","For Sale",33.99851,-118.46734,"CA","Venice",NA,"25610123","Carport","Tucked away on one of Venice's most desirable and peaceful streets, this newly crafted home blends timeless materials with modern California design. Nearly 2,500 SF of living space unfolds in a seamless balance of luxury and warmth, with wide-plank white oak floors, natural cedar siding, and custom designer finishes throughout. At the heart of the home lies a stunning custom kitchen featuring arbescato marble countertops, plaster walls, and bespoke custom white oak cabinetry with a fully integra",NA,"1925",NA,"","property_images/72506359_img1.jpg","https://www.zillow.com/homedetails/709-Vernon-Ave-Venice-CA-90291/72506359_zpid/",2025-11-21 09:50:26.029478
"20541967","$599,000","674 Palmera Ave, Pacific Palisades, CA 90272",NA,NA,"4,565",131.22,NA,"For Sale",34.047455,-118.5381,"CA","Pacific Palisades",NA,"25498371","Carport","The most affordable vacant lot in the highly desirable Pacific Palisades offers a unique chance to build something special. While affected by the recent Palisades fire, it now presents a fresh start for buyers with vision. Conveniently close to Sunset, PCH, Temescal Canyon, and all the Village has to offer, this property is perfect for those looking to invest, rebuild, and bring new life to a deserving and sought-after area of Los Angeles. Phase 1 and 2 has been completed by the Army Corps of En",NA,NA,NA,"","property_images/20541967_img1.jpg","https://www.zillow.com/homedetails/674-Palmera-Ave-Pacific-Palisades-CA-90272/20541967_zpid/",2025-11-21 09:50:26.029478
"20926863","$850,000","6119 Haas Ave, Los Angeles, CA 90047","3","3","1,303",652.34,"Single Family","For Sale",33.98386,-118.31704,"CA","Los Angeles",NA,"CV25259610","Carport","Listing Provided by: Uriel Ojeda DRE #01474944 uriel@theojedateam.com,PAK HOME REALTY Welcome to 6119 Haas Ave — where timeless Spanish charm meets modern sophistication. Nestled in the heart of Los Angeles, this beautifully remodeled 3-bedroom, 2.5-bath home offers 1,304 square feet of thoughtfully designed living space. Every detail was carefully chosen to preserve the classic Spanish character while incorporating elegant, contemporary upgrades for today’s lifestyle. Step inside to discover a ",NA,"1929",NA,"","property_images/20926863_img1.jpg","https://www.zillow.com/homedetails/6119-Haas-Ave-Los-Angeles-CA-90047/20926863_zpid/",2025-11-21 09:50:26.029478
"20523173","$4,995,000","1648 Summitridge Dr, Beverly Hills, CA 90210","5","7","5,404",924.32,"Single Family","For Sale",34.101192,-118.41884,"CA","Beverly Hills",NA,"25600155","Carport","Perched in an exclusive enclave of Beverly Hills, this reimagined modern estate spans 1.24 acres of gated hillside, offering unrivaled privacy and sweeping jetliner views from the Pacific Ocean to the Downtown skyline. A long private drive and expansive motor court introduce the home, framed by lush, curated landscaping. Nearly every room opens to breathtaking views, with walls of glass and seamless indoor-outdoor transitions designed for both intimate living and entertaining. The formal dining ",NA,"1940","19401.24","","property_images/20523173_img1.jpg","https://www.zillow.com/homedetails/1648-Summitridge-Dr-Beverly-Hills-CA-90210/20523173_zpid/",2025-11-21 09:50:26.029478
"20524401","$49,500,000","570 S Mapleton Dr, Los Angeles, CA 90024","5","9","7,826",6325.07,"Single Family","For Sale",34.074306,-118.42829,"CA","Los Angeles",NA,"25556491","Carport","Located on one of the most desirable streets in all of Los Angeles, this estate is on an all useable 1.45 acres with 210 ft frontage on the 14th hole of the famed Los Angeles Country Club. The 1930's Country English home was remodeled in 1979 and is now available for sale for the first time in decades. The home is 7,826 sf ft and the property includes a sunny pool, huge lawns, and a N/S lighted tennis court bordering the country club. The property is totally private and gated with a circular dri",NA,"1930","19301.45","","property_images/20524401_img1.jpg","https://www.zillow.com/homedetails/570-S-Mapleton-Dr-Los-Angeles-CA-90024/20524401_zpid/",2025-11-21 09:50:26.029478
"19991740","$4,995,000","4620 Rubio Ave, Encino, CA 91436","5","6","5,894",847.47,"Single Family","For Sale",34.15522,-118.494064,"CA","Encino",NA,"25611343","Carport","Imagine owning this trophy property of historical significance which was designed in 1939 by J. R. Davidson, a pivotal figure in the Los Angeles modern architecture movement known for his iconic Case Study homes. This gated single-level mid-century home offers lush landscaping and privacy and exemplifies the signature warmth and fluidity of Davidson's architectural style. Recently reimagined and updated with the finest materials that blend perfectly with the architect's original vision of seamle",NA,"1939","19390.65","","property_images/19991740_img1.jpg","https://www.zillow.com/homedetails/4620-Rubio-Ave-Encino-CA-91436/19991740_zpid/",2025-11-21 09:53:12.974234
"20176125","$899,900","9701 Crebs Ave, Northridge, CA 91324","3","2","1,704",528.11,"Single Family","For Sale",34.24651,-118.54421,"CA","Northridge",NA,"SR25262670","2","Listing Provided by: Shawn Shai Halahmy DRE #01088893 818-613-7355,BrokerInTrust Real Estate-Shawn Shai Halahmy * * Welcome home to this wonderful property * * 1st time on the market in 34 years * * Approximately 1700 sf with 3 bedrooms, 2 bathrooms, a huge family room, a sparkling pool, a 2 car garage, great yard with RV/Boat access, BUT wait, there's so much more! * * This great home has just been updated with a new roof, a new kitchen, new appliances, new flooring, new paint, updated and new ",NA,"1960",NA,"","property_images/20176125_img1.jpg","https://www.zillow.com/homedetails/9701-Crebs-Ave-Northridge-CA-91324/20176125_zpid/",2025-11-21 09:53:12.974234
"20385066","$1,795,000","7520 W 82nd St, Playa Del Rey, CA 90293","3","3","2,544",705.58,"Single Family","For Sale",33.96198,-118.42896,"CA","Playa Del Rey",NA,"SB25239507","Carport","Listing Provided by: Debbie Efthimos DRE #02140981 801-209-1298,Compass,Nicole Nolan DRE #02133654,Compass Experience the best of coastal living in this lovely Lewis designed home (“Tiburon” floor plan) nestled in the highly sought after Pacific Heights neighborhood of Playa del Rey. This light-filled home offers 3 spacious bedrooms, a versatile den, office or guest bedroom, and 2.5 baths, each space thoughtfully planned for comfortable living. Step into the sunlit, step-down living room featuri",NA,"1985",NA,"","property_images/20385066_img1.jpg","https://www.zillow.com/homedetails/7520-W-82nd-St-Playa-Del-Rey-CA-90293/20385066_zpid/",2025-11-21 09:53:12.974234
"20383768","$3,349,000","8227 Stewart Ave, Los Angeles, CA 90045","5","5","3,426",977.52,"Single Family","For Sale",33.96365,-118.40903,"CA","Los Angeles",NA,"25614987","Carport","Come and experience this captivating modern farmhouse, a perfect expression of California casual sophistication. This stunning residence showcases a generous, light-filled floor plan with soaring ceilings, gleaming wood floors, and custom designer finishes that elevate every space. From the moment you enter, you will appreciate the thoughtful craftsmanship and fine details.The expansive main living area flows effortlessly into a sunlit formal dining room, highlighted by a wood beam ceiling and d",NA,"2018",NA,"","property_images/20383768_img1.jpg","https://www.zillow.com/homedetails/8227-Stewart-Ave-Los-Angeles-CA-90045/20383768_zpid/",2025-11-21 09:53:12.974234
"458406523","$647,000","330 W 11th St #A503, Los Angeles, CA 90015","2","2","1,400",462.14,"Condo","For Sale",34.041157,-118.26183,"CA","Los Angeles","1269","BB25260510","Carport","Listing Provided by: Mark Richards DRE #02105271 877-973-3346,Redfin Corporation Welcome to Downtown LA living at its finest. Unit A503 at 330 W 11th St offers a stylish blend of modern comfort and urban character in one of the most vibrant neighborhoods in the city. This light-filled residence features soaring ceilings, oversized windows, and an open-concept layout that creates an airy, loft-like atmosphere. The spacious living area flows seamlessly into a contemporary kitchen equipped with sle",NA,"2005",NA,"","property_images/458406523_img1.jpg","https://www.zillow.com/homedetails/330-W-11th-St-A503-Los-Angeles-CA-90015/458406523_zpid/",2025-11-21 09:53:12.974234
"20790445","$625,000","5164 Romaine St, Los Angeles, CA 90029","8","2","1,602",390.14,"Single Family","For Sale",34.08835,-118.304474,"CA","Los Angeles",NA,"TR25246513","Carport","Listing Provided by: Jonathan Minerick DRE #01523060 888-400-2513,Homecoin.com MAJOR FIXER ALERT!! Calling all investors, developers, and savvy homebuyers — check out this INCREDIBLE Hollywood opportunity! Welcome to 5164 Romaine, a fantastic fixer and rehab project located in the heart of Hollywood. This complete fixer is ready to be reimagined and brought back to life! Create your DREAM HOME, execute a FIX-and-FLIP, transform it into an Airbnb/VACATION RENTAL, or hold as a RENTAL INVESTMENT fo",NA,"1910",NA,"","property_images/20790445_img1.jpg","https://www.zillow.com/homedetails/5164-Romaine-St-Los-Angeles-CA-90029/20790445_zpid/",2025-11-21 09:53:12.974234
"51578792","$1,099,999","22715 Keswick St, West Hills, CA 91304","4","3","2,268",485.01,"Single Family","For Sale",34.210537,-118.62202,"CA","West Hills",NA,"SR25253381","Carport","Listing Provided by: Jim Sandoval DRE #01726729 jsandoval@parkregency.com,Park Regency Realty Welcome home to this warm and inviting retreat set on a peaceful cul-de-sac! Thoughtfully upgraded for both comfort and entertaining, this beautiful POOL home combines timeless style with modern touches and ample space for family and friends to gather. The home also offers a rare bonus — GATED RV ACCESS that opens to the backyard with up to 55 feet of parking space, plus a three-car direct-access garage",NA,"1975",NA,"","property_images/51578792_img1.jpg","https://www.zillow.com/homedetails/22715-Keswick-St-West-Hills-CA-91304/51578792_zpid/",2025-11-21 09:53:12.974234
"97851460","$689,999","6001 Carlton Way APT 410, Los Angeles, CA 90028","1","1","870",793.1,"Condo","For Sale",34.100727,-118.32019,"CA","Los Angeles","766","25620903","Carport","Introducing Unit 410 at the exclusive Metropol Hollywood. This rare and coveted one bedroom penthouse residence embodies the finest elements of elevated modern design. Greeted by nine-foot ceilings, the loft-inspired layout is framed by expansive windows that capture unobstructed east-facing views stretching from the iconic Griffith Observatory to the innovative Netflix campus. With over 900 sqft of living space, this vibrant, light-filled home offers dedicated spaces for dining, relaxing, and w",NA,"2009",NA,"","property_images/97851460_img1.jpg","https://www.zillow.com/homedetails/6001-Carlton-Way-APT-410-Los-Angeles-CA-90028/97851460_zpid/",2025-11-21 09:53:12.974234
"20108458","$1,800,000","11542 Encino Ave, Granada Hills, CA 91344","5","3","2,264",795.05,"Single Family","For Sale",34.280422,-118.51467,"CA","Granada Hills",NA,"25580103","Carport","Wonderful development opportunity on a quiet cul-de-sac on a prime 18,000 sf lot in one of Granada Hills' best neighborhoods. RTI plans are ready for issue to replace the current 2,264 sf single-story home with a stunning 7,000 sf, 3-story, 5-bedroom, 5 1/2-bathroom contemporary home that includes a basement, elevator, balconies, and stunning poolside ADU.",NA,"1964","19640.41","","property_images/20108458_img1.jpg","https://www.zillow.com/homedetails/11542-Encino-Ave-Granada-Hills-CA-91344/20108458_zpid/",2025-11-21 09:53:12.974234
"244500271","$699,950","14909 W Navarre Way, Sylmar, CA 91342","4","3","1,574",444.7,"Single Family","For Sale",34.294857,-118.45554,"CA","Sylmar","23","SR25258363","Carport","Listing Provided by: Stephanie Vitacco DRE #00985615 818-298-6458,Equity Union Nestled within the Cabrillo Collection, a well-planned community developed by California Home Builders, this inviting 4-bedroom, 2.5-bath residence blends modern comfort with practical design. The home’s freshly painted interior and new carpeting on the stairs and upper level create a bright, move-in-ready atmosphere, complemented by stylish vinyl flooring throughout the main level. The kitchen is thoughtfully designe",NA,"2017",NA,"","property_images/244500271_img1.jpg","https://www.zillow.com/homedetails/14909-W-Navarre-Way-Sylmar-CA-91342/244500271_zpid/",2025-11-21 09:55:56.866877
"20571157","$699,000","1021 W 48th St, Los Angeles, CA 90037","5","4","2,096",333.49,"Single Family","For Sale",33.99989,-118.29245,"CA","Los Angeles",NA,"RS25258962","Carport","Listing Provided by: Mark Perez DRE #01279393 562-754-0660,Circle Real Estate,Gabriel Mejorado DRE #02113110,Circle Real Estate Investor opportunity in the heart of Vermont Square! This Craftsman-style home offers 7 bedrooms and 2 bathrooms across 2,096 sq. ft. of living space, situated on a 6,470 sq. ft. lot. The property is legally a duplex that was converted into a single-family residence at an unknown time, creating a spacious floor plan with one bedroom upstairs and the rest on the main lev",NA,"1923",NA,"","property_images/20571157_img1.jpg","https://www.zillow.com/homedetails/1021-W-48th-St-Los-Angeles-CA-90037/20571157_zpid/",2025-11-21 09:55:56.866877
"20007140","$899,998","6539 Ventura Canyon Ave, Van Nuys, CA 91401","4","3","1,822",493.96,"Single Family","For Sale",34.18973,-118.429214,"CA","Van Nuys",NA,"SR25254296","Carport","Listing Provided by: Lilith Berko DRE #01412242 818-395-6101,JohnHart Real Estate Rare Valley Glen opportunity — architect-designed mid-century gem, first time on market in over 60 years. Privately tucked away in a highly sought-after Valley Glen enclave, this 4-bedroom, 2.5-bath residence offers 1,822 sq. ft. of thoughtfully designed living space on a generous (almost 7,500 sq. ft.) lot. Solid bones and clean lines provide the perfect canvas to create your ideal home. The detached 2-car garage ",NA,"1959",NA,"","property_images/20007140_img1.jpg","https://www.zillow.com/homedetails/6539-Ventura-Canyon-Ave-Van-Nuys-CA-91401/20007140_zpid/",2025-11-21 09:55:56.866877
"20508505","$5,200,000","1338 Comstock Ave, Los Angeles, CA 90024","6","6","3,242",1603.95,"Single Family","For Sale",34.0654,-118.42491,"CA","Los Angeles",NA,"25618745","Carport","Located in the highly desirable Comstock Hills enclave of Westwood, this beautifully updated and reimagined residence blends classic architectural charm with modern sophistication. Bright, open living spaces are designed for both comfort and effortless daily living. The main home features 5 bedroomsincluding 4 ensuite bedrooms upstairs and 1 bedroom on the main levelplus an additional bedroom in the separate guest house. The private backyard retreat is an entertainer's dream, showcasing a sparkl",NA,"1938",NA,"","property_images/20508505_img1.jpg","https://www.zillow.com/homedetails/1338-Comstock-Ave-Los-Angeles-CA-90024/20508505_zpid/",2025-11-21 09:55:56.866877
"20501045","$589,000","1831 Prosser Ave APT 101, Los Angeles, CA 90025","2","2","1,066",552.53,"Condo","For Sale",34.052666,-118.42893,"CA","Los Angeles","735","25619535","Carport","You're going to love this bright and airy 2 bedroom, 2 bathroom condo tucked on a quiet tree-lined street. Located in a highly sought after pocket of West LA near Century City and Westwood. This ground-floor unit sits in a prime spot within the building, facing directly toward the sparkling community pool for a relaxing, sunny outlook. Inside, you'll find a spacious layout with brand new laminate wood flooring and fresh paint throughout. The large living room opens to an inviting balcony with po",NA,"1970",NA,"","property_images/20501045_img1.jpg","https://www.zillow.com/homedetails/1831-Prosser-Ave-APT-101-Los-Angeles-CA-90025/20501045_zpid/",2025-11-21 09:55:56.866877
"20937620","$875,000","1848 W 78th St, Los Angeles, CA 90047","2","2","1,241",705.08,"Single Family","For Sale",33.967903,-118.31067,"CA","Los Angeles",NA,"DW25258172","Carport","Listing Provided by: Dennis Cid DRE #02106156 562-222-9315,Circle Real Estate Welcome to a turn-key home in the highly sought-after Manchester Square neighborhood, perfectly positioned near the vibrant Inglewood entertainment district (SoFi Stadium, Kia Forum, Intuit Dome, and LAX). This home boasts beautiful original charm with extensive, high-value modern upgrades for low-maintenance living. Step inside to find original hardwood flooring with an unreplicated design, a large living room with a ",NA,"1931",NA,"","property_images/20937620_img1.jpg","https://www.zillow.com/homedetails/1848-W-78th-St-Los-Angeles-CA-90047/20937620_zpid/",2025-11-21 09:55:56.866877
"451830272","$2,167,500","11929 N Ricasoli Way, Porter Ranch, CA 91326","5","6","3,994",542.69,"Single Family","For Sale",34.29015,-118.58488,"CA","Porter Ranch","443","SR25258934","Carport","Listing Provided by: Stephanie Vitacco DRE #00985615 818-298-6458,Equity Union Experience exceptional luxury & panoramic mountain & city light views in this meticulously appointed 5 bed, 5.5 bath, nearly 4K sq ft residence located in the prestigious guard-gated community of Bella Vista, Porter Ranch. Showcasing high ceilings, recessed lighting, built-in speaker system, & engineered wood flooring throughout, this home blends refined design w/ modern convenience including energy efficient, owned, ",NA,"2015",NA,"","property_images/451830272_img1.jpg","https://www.zillow.com/homedetails/11929-N-Ricasoli-Way-Porter-Ranch-CA-91326/451830272_zpid/",2025-11-21 09:55:56.866877
"20559449","$49,500,000","12705 Chalon Rd, Los Angeles, CA 90049","7","11","11,449",4323.52,"Single Family","For Sale",34.083813,-118.49853,"CA","Los Angeles","2800","25531613","Carport","At the end of a cul-de-sac in ultra-exclusive Brentwood Country Estates lies a sprawling Tuscan residence set on manicured grounds. Guests arrive through a large iron gate and into a massive motor court, its perimeter lined with privacy hedges beneath towering palms and Mediterranean cypress. Enjoy striking panoramas of vivid green hills, canyons, and untouched mountains beyond. A lighted north-south tennis/pickleball court includes a trellis-covered viewing pavilion, basketball hoop, equipment ",NA,"2001","20012.47","","property_images/20559449_img1.jpg","https://www.zillow.com/homedetails/12705-Chalon-Rd-Los-Angeles-CA-90049/20559449_zpid/",2025-11-21 09:55:56.866877
"20987691","$649,900","16124 S Hoover St, Gardena, CA 90247","2","1","739",879.43,"Single Family","For Sale",33.884613,-118.28695,"CA","Gardena",NA,"WS25256308","Carport","Listing Provided by: JESSICA SPELLERBERG DRE #02078715 424-212-3550,Wedgewood Homes Realty Welcome to 16124 Hoover Street, a beautifully updated home tucked nicely away in a cul-de-sac in the heart of Gardena. This move-in ready gem has been freshly updated with new interior and exterior paint, new fixtures, and thoughtful touches throughout. You’ll love the warmth of the original hardwood flooring, the comfort of dual-pane windows, and the abundance of natural light that fills every room. The s",NA,"1941",NA,"","property_images/20987691_img1.jpg","https://www.zillow.com/homedetails/16124-S-Hoover-St-Gardena-CA-90247/20987691_zpid/",2025-11-21 09:55:56.866877
